anime_id,name,genre,type,episodes,rating,members
397,Seikai no Senki II,"Action, Military, Romance, Sci-Fi, Space",TV,10,7.97,13888
949,Top wo Nerae! Gunbuster,"Action, Comedy, Drama, Mecha, Military, Sci-Fi, Shounen, Space",OVA,6,7.97,51724
11001,Toshokan Sensou: Kakumei no Tsubasa,"Action, Comedy, Military, Romance",Movie,1,7.96,10244
17909,Uchouten Kazoku,"Comedy, Drama, Fantasy, Slice of Life",TV,13,7.96,64897
21185,Baby Steps,"Romance, School, Shounen, Sports",TV,25,7.96,59818
9724,Break Blade 5: Shisen no Hate,"Action, Mecha, Military, Shounen",Movie,1,7.96,40053
6768,Code Geass: Hangyaku no Lelouch R2 Special Edition Zero Requiem,"Action, Mecha, Military, Super Power",OVA,1,7.96,23204
4872,Goku Sayonara Zetsubou Sensei,"Comedy, Parody, School",OVA,3,7.96,40358
12413,Jormungand,"Action, Adventure, Seinen",TV,12,7.96,137610
2076,Kindaichi Shounen no Jikenbo (TV),"Mystery, Shounen",TV,148,7.96,8655
31251,Mobile Suit Gundam: Iron-Blooded Orphans,"Action, Drama, Mecha, Sci-Fi, Space",TV,25,7.96,60525
5485,Shin Mazinger Shougeki! Z-hen,"Action, Mecha, Shounen, Super Power",TV,26,7.96,7872
5005,Tentai Senshi Sunred,"Comedy, Parody, Seinen, Super Power",TV,26,7.96,12236
890,Yuusha-Ou GaoGaiGar,"Adventure, Mecha, Sci-Fi, Shounen",TV,49,7.96,10031
269,Bleach,"Action, Comedy, Shounen, Super Power, Supernatural",TV,366,7.95,624055
14741,Chuunibyou demo Koi ga Shitai!,"Comedy, Drama, Romance, School, Slice of Life",TV,12,7.95,394399
1472,City Hunter 3,"Action, Comedy, Mystery, Shounen",TV,13,7.95,6723
33028,Danganronpa 3: The End of Kibougamine Gakuen - Zetsubou-hen,"Action, Horror, Mystery, Psychological",TV,11,7.95,65503
7304,Detective Conan Movie 08: Time Travel of the Silver Sky,"Adventure, Mystery",Special,1,7.95,6515
8609,Detective Conan OVA 10: Kid in Trap Island,"Adventure, Comedy, Mystery, Police, Shounen",OVA,1,7.95,7757
6033,Dragon Ball Kai,"Action, Adventure, Comedy, Fantasy, Martial Arts, Shounen, Super Power",TV,97,7.95,116832
8479,Hetalia World Series,"Comedy, Historical, Parody",ONA,48,7.95,64416
254,Jungle wa Itsumo Hare nochi Guu Deluxe,"Comedy, Slice of Life",OVA,6,7.95,8847
8525,Kami nomi zo Shiru Sekai,"Comedy, Harem, Romance, Shounen, Supernatural",TV,12,7.95,284846
19703,Kyousou Giga (TV),"Action, Fantasy, Supernatural",TV,10,7.95,67732
25517,Magic Kaito 1412,"Adventure, Comedy, Romance, Shounen",TV,24,7.95,43545
31764,Nejimaki Seirei Senki: Tenkyou no Alderamin,"Action, Adventure, Fantasy, Military",TV,13,7.95,86475
27775,Plastic Memories,"Drama, Romance, Sci-Fi",TV,13,7.95,213493
21339,Psycho-Pass Movie,"Action, Military, Police, Sci-Fi",Movie,1,7.95,94677
2104,Seto no Hanayome,"Comedy, Parody, Romance, School",TV,26,7.95,165008
24893,Sidonia no Kishi: Daikyuu Wakusei Seneki,"Action, Mecha, Sci-Fi, Seinen, Space",TV,12,7.95,57665
2150,Tanoshii Muumin Ikka,"Adventure, Comedy, Fantasy, Kids, Slice of Life",TV,78,7.95,7761
12445,Tasogare Otome x Amnesia,"Horror, Mystery, Romance, School, Shounen, Supernatural",TV,12,7.95,172367
543,Vampire Hunter D (2000),"Action, Drama, Fantasy, Horror, Romance, Sci-Fi, Vampire",Movie,1,7.95,68229
23225,Yuru Yuri Nachuyachumi!,"Comedy, Shoujo Ai, Slice of Life",OVA,1,7.95,28339
9252,Break Blade 3: Kyoujin no Ato,"Action, Fantasy, Mecha, Military, Shounen",Movie,1,7.94,42653
12893,Danshi Koukousei no Nichijou Specials,"Comedy, School, Shounen, Slice of Life",Special,6,7.94,49891
1505,Detective Conan Movie 09: Strategy Above the Depths,"Adventure, Comedy, Mystery, Police, Shounen",Movie,1,7.94,20347
4447,Detective Conan Movie 12: Full Score of Fear,"Adventure, Comedy, Mystery, Police, Shounen",Movie,1,7.94,19290
317,Final Fantasy VII: Advent Children,"Action, Fantasy, Super Power",Movie,1,7.94,138659
22265,Free!: Eternal Summer,"Comedy, School, Slice of Life, Sports",TV,13,7.94,150596
13117,Hakuouki Movie 1: Kyoto Ranbu,"Action, Drama, Historical, Josei, Samurai, Supernatural",Movie,1,7.94,12076
9563,Hidamari Sketch x ☆☆☆ Specials,"Comedy, School, Slice of Life",Special,2,7.94,8734
16904,K: Missing Kings,"Action, Super Power, Supernatural",Movie,1,7.94,98549
97,Last Exile,"Action, Adventure, Sci-Fi",TV,26,7.94,104193
20517,Little Busters!: EX,"Comedy, Drama, Romance, School, Slice of Life, Supernatural",Special,8,7.94,26709
2273,Mobile Suit Gundam Wing: Endless Waltz Movie,"Action, Drama, Mecha, Military, Sci-Fi, Space",Movie,1,7.94,35711
1735,Naruto: Shippuuden,"Action, Comedy, Martial Arts, Shounen, Super Power",TV,Unknown,7.94,533578
20159,Pokemon: The Origin,"Action, Adventure, Comedy, Fantasy, Kids",Special,4,7.94,85947
12403,Yuru Yuri♪♪,"Comedy, School, Shoujo Ai, Slice of Life",TV,12,7.94,83097
7044,Zan Sayonara Zetsubou Sensei Bangaichi,"Comedy, Parody, School",OVA,2,7.94,22704
31646,3-gatsu no Lion,"Drama, Game, Seinen, Slice of Life",TV,23,7.93,59492
32998,91 Days,"Action, Drama, Historical",TV,12,7.93,140604
30123,Akagami no Shirayuki-hime,"Drama, Fantasy, Romance, Shoujo",TV,12,7.93,157551
31339,Drifters,"Action, Adventure, Comedy, Fantasy, Historical, Samurai, Seinen",TV,12,7.93,102857
2890,Gake no Ue no Ponyo,"Adventure, Fantasy",Movie,1,7.93,140277
468,Ghost in the Shell 2: Innocence,"Mecha, Military, Police, Psychological, Sci-Fi",Movie,1,7.93,85714
29755,Haikyuu!! Movie 1: Owari to Hajimari,"Comedy, Drama, School, Shounen, Sports",Movie,1,7.94,13094
25303,Haikyuu!! OVA,"Shounen, Sports",OVA,2,7.93,30063
24471,Hoozuki no Reitetsu OVA,"Comedy, Fantasy, Supernatural",OVA,3,7.93,6073
516,Keroro Gunsou,"Comedy, Sci-Fi, Shounen",TV,358,7.93,31632
1425,Lupin III: Part II,"Action, Adventure, Comedy, Shounen",TV,155,7.93,10873
5310,Macross F Movie 1: Itsuwari no Utahime,"Action, Mecha, Military, Music, Romance, Sci-Fi, Space",Movie,1,7.93,20637
93,Mobile Suit Gundam Seed,"Action, Drama, Mecha, Military, Romance, Sci-Fi, Space",TV,50,7.93,96973
8038,Nodame Cantabile Finale Special,"Comedy, Josei, Music, Romance",Special,1,7.93,23388
322,Paradise Kiss,"Comedy, Drama, Josei, Romance, Slice of Life",TV,12,7.93,86380
6154,Saint Seiya: The Hades Chapter Sanctuary - Yomigaerishi Gold Saint-tachi no Shinwa,"Adventure, Sci-Fi, Shounen",Special,2,7.93,4975
7588,Saraiya Goyou,"Historical, Samurai, Seinen",TV,12,7.93,40819
10083,Shiki Specials,"Horror, Mystery, Supernatural, Vampire",Special,2,7.93,37657
1172,Slayers Try,"Adventure, Comedy, Demons, Fantasy, Magic, Shounen",TV,26,7.93,32742
31711,To LOVE-Ru Darkness 2nd Specials,"Comedy, Ecchi, Harem, Romance, School, Sci-Fi, Shounen",Special,2,7.93,22487
2265,Transformers the Movie,"Action, Mecha",Movie,1,7.93,6540
23249,Uchuu Senkan Yamato 2199: Hoshimeguru Hakobune,"Action, Drama, Military, Sci-Fi, Space",Movie,1,7.93,5431
202,Wolf&#039;s Rain,"Action, Adventure, Drama, Fantasy, Mystery, Sci-Fi",TV,26,7.93,171863
30370,Akatsuki no Yona OVA,"Action, Comedy, Fantasy, Shoujo",OVA,3,7.92,29398
9919,Ao no Exorcist,"Action, Demons, Fantasy, Shounen, Supernatural",TV,25,7.92,583823
1818,Claymore,"Action, Adventure, Demons, Fantasy, Shounen, Super Power, Supernatural",TV,26,7.92,316853
34036,Detective Conan: Episode One - Chiisaku Natta Meitantei,"Adventure, Comedy, Mystery, Police, Shounen",Special,1,8.10,2493
10090,Ghost in the Shell: Stand Alone Complex - Solid State Society 3D,"Mecha, Military, Mystery, Police, Sci-Fi, Seinen",Movie,1,7.91,7515
17895,Golden Time,"Comedy, Romance, Seinen",TV,24,7.92,273191
1824,Hadashi no Gen,"Drama, Historical",Movie,1,7.92,16474
4192,Hayate no Gotoku!!,"Action, Comedy, Harem, Parody, Romance",TV,25,7.92,67323
10357,Jinrui wa Suitai Shimashita,"Comedy, Fantasy, Seinen",TV,12,7.92,89373
30745,Kyoukai no Kanata Movie: I&#039;ll Be Here - Kako-hen - Yakusoku no Kizuna,Music,Special,1,7.92,10306
19489,Little Witch Academia: Mahoujikake no Parade,"Adventure, Comedy, Fantasy, Magic, School",Movie,1,7.92,53024
4472,Lucky☆Star: Original na Visual to Animation,"Comedy, Parody, School, Slice of Life",OVA,1,7.92,84833
19613,New Initial D Movie: Legend 1 - Kakusei,"Action, Cars, Seinen, Sports",Movie,1,7.92,7695
5530,Pandora Hearts,"Adventure, Fantasy, Mystery, Shounen, Supernatural",TV,25,7.92,229567
6591,Rurouni Kenshin DVD-BOX Special Ending,"Historical, Romance",Special,1,7.92,9695
10218,Berserk: Ougon Jidai-hen I - Haou no Tamago,"Action, Adventure, Demons, Fantasy, Military, Seinen, Supernatural",Movie,1,7.91,77103
388,Capeta,"Cars, Shounen, Sports",TV,52,7.91,9711
28999,Charlotte,"Drama, School, Super Power",TV,13,7.91,310137
1473,City Hunter &#039;91,"Action, Comedy, Mystery, Shounen",TV,13,7.91,6337
1379,Kino no Tabi: Nanika wo Suru Tame ni - Life Goes On.,"Adventure, Drama, Fantasy",Movie,1,7.91,26746
23293,Lupin the IIIrd: Jigen Daisuke no Bohyou,"Action, Adventure, Comedy, Drama, Seinen",Movie,1,7.91,5939
1910,Master Keaton OVA,"Adventure, Mystery",OVA,15,7.91,3205
33221,Mobile Suit Gundam Thunderbolt: December Sky,"Action, Drama, Mecha, Military, Sci-Fi, Space",Movie,1,7.92,2833
18897,Nisekoi,"Comedy, Harem, Romance, School, Shounen",TV,20,7.91,347599
31592,Pokemon XY&amp;Z,"Action, Adventure, Comedy, Fantasy, Kids",TV,47,7.91,15627
31380,To LOVE-Ru Darkness 2nd OVA,"Comedy, Ecchi, Harem, Romance, School, Sci-Fi, Shounen",OVA,3,7.91,18575
28677,Yamada-kun to 7-nin no Majo (TV),"Comedy, Harem, Mystery, Romance, School, Shounen, Supernatural",TV,12,7.91,193566
7193,Aoi Bungaku Series,"Drama, Historical, Psychological, Seinen, Thriller",TV,12,7.90,93074
1961,Arashi no Yoru ni,"Adventure, Comedy, Drama, Fantasy",Movie,1,7.90,11458
21405,Bokura wa Minna Kawaisou,"Comedy, Romance, School, Slice of Life",TV,12,7.90,159793
6024,Chi&#039;s Sweet Home: Atarashii Ouchi,"Comedy, Kids, Slice of Life",TV,104,7.90,16670
2761,Densetsu Kyojin Ideon: Hatsudou-hen,"Drama, Mecha, Sci-Fi, Space",Movie,1,7.90,2963
1491,Ginga Tetsudou 999,"Adventure, Drama, Sci-Fi, Space",TV,113,7.90,12672
106,Hana yori Dango,"Drama, Romance, School, Shoujo",TV,51,7.90,28341
5835,Hanasakeru Seishounen,"Drama, Romance, Shoujo",TV,39,7.90,37051
3604,Hidamari Sketch x 365,"Comedy, School, Slice of Life",TV,13,7.90,19180
11237,Hidamari Sketch x SP,"Comedy, School, Slice of Life",Special,2,7.90,7999
2828,Ie Naki Ko,"Adventure, Drama, Historical, Kids, Slice of Life",TV,51,7.90,4479
4087,Michiko to Hatchin,"Action, Adventure",TV,22,7.90,82625
28881,New Initial D Movie: Legend 2 - Tousou,"Cars, Seinen, Sports",Movie,1,7.90,4641
21473,Persona 3 the Movie 2: Midsummer Knight&#039;s Dream,"Action, Fantasy, Seinen, Supernatural",Movie,1,7.90,27462
582,Sexy Commando Gaiden: Sugoiyo!! Masaru-san,"Comedy, Martial Arts, School, Shounen",TV,48,7.90,6473
8311,Tegamibachi Reverse,"Adventure, Fantasy, Shounen, Supernatural",TV,25,7.90,36228
21995,Ao Haru Ride,"Comedy, Drama, Romance, School, Shoujo, Slice of Life",TV,12,7.89,227417
532,Bishoujo Senshi Sailor Moon S,"Drama, Magic, Romance, Shoujo",TV,38,7.89,66911
552,Digimon Adventure,"Action, Adventure, Comedy, Fantasy, Kids",TV,54,7.89,182208
13629,Furiko,"Drama, Music, Romance, Slice of Life",Special,1,7.89,8809
7645,Heartcatch Precure!,"Action, Comedy, Fantasy, Magic, School, Shoujo, Slice of Life",TV,49,7.89,12825
249,InuYasha,"Action, Adventure, Comedy, Demons, Fantasy, Magic, Romance, Shounen, Supernatural",TV,167,7.89,281632
4886,InuYasha: Kuroi Tessaiga,"Adventure, Comedy, Demons, Fantasy, Magic, Romance, Shounen, Supernatural",Special,1,7.89,16373
451,InuYasha: Tenka Hadou no Ken,"Adventure, Comedy, Demons, Drama, Fantasy, Historical, Romance, Shounen, Supernatural",Movie,1,7.89,51079
9734,K-On!!: Keikaku!,"Comedy, Music, School, Slice of Life",Special,1,7.89,50496
433,"Kumo no Mukou, Yakusoku no Basho","Drama, Military, Romance, Sci-Fi",Movie,1,7.89,103975
6115,Lupin III vs. Detective Conan,"Action, Adventure, Comedy, Mystery, Shounen",Special,1,7.89,15220
80,Mobile Suit Gundam,"Action, Mecha, Military, Sci-Fi, Space",TV,43,7.89,51566
1092,Mobile Suit Gundam III: Encounters in Space,"Action, Adventure, Drama, Mecha, Military, Sci-Fi, Space",Movie,1,7.89,11343
20767,Noragami OVA,"Action, Adventure, Shounen",OVA,2,7.89,104775
10119,Seitokai Yakuindomo OVA,"Comedy, School, Shounen, Slice of Life",OVA,8,7.89,63265
1921,Urusei Yatsura Movie 2: Beautiful Dreamer,"Action, Adventure, Comedy, Drama, Romance, Sci-Fi",Movie,1,7.89,5663
1562,Yamato Nadeshiko Shichihenge♥,"Comedy, Shoujo",TV,25,7.89,92088
11111,Another,"Horror, Mystery, School, Supernatural, Thriller",TV,12,7.88,534657
32863,Ansatsu Kyoushitsu (TV) 2nd Season: Kagaijugyou-hen,"Action, Comedy, School, Shounen",ONA,8,7.88,7999
11737,Ao no Exorcist Movie,"Action, Demons, Fantasy, Shounen, Supernatural",Movie,1,7.88,105183
28249,Arslan Senki (TV),"Action, Adventure, Drama, Fantasy, Historical, Shounen",TV,25,7.88,152811
13535,Binbougami ga!,"Comedy, Parody, Shounen, Supernatural",TV,13,7.88,117091
1520,Black Jack,Drama,OVA,12,7.88,14414
28121,Dungeon ni Deai wo Motomeru no wa Machigatteiru Darou ka,"Action, Adventure, Comedy, Fantasy, Romance",TV,13,7.88,336349
30191,Durarara!!x2 Shou: Watashi no Kokoro wa Nabe Moyou,"Action, Mystery, Supernatural",Special,1,7.88,22774
10497,Hetalia World Series Specials,"Comedy, Historical, Parody",Special,4,7.88,14348
6862,K-On!: Live House!,"Comedy, Music, School, Slice of Life",Special,1,7.88,70787
251,Kyou kara Maou!,"Adventure, Comedy, Demons, Fantasy, Shoujo",TV,78,7.88,58150
18153,Kyoukai no Kanata,"Fantasy, Slice of Life, Supernatural",TV,12,7.88,359011
875,Mind Game,"Adventure, Comedy, Dementia, Psychological, Romance",Movie,1,7.88,32756
795,Oniisama e...,"Drama, School, Shoujo, Shoujo Ai",TV,39,7.88,11424
33994,Servamp Specials,Comedy,Special,3,7.88,5973
18397,Shingeki no Kyojin OVA,"Action, Drama, Fantasy, Shounen, Super Power",OVA,3,7.88,121063
29830,Tamayura: Sotsugyou Shashin Part 3 - Akogare,"Comedy, Drama, Slice of Life",Movie,1,7.88,3089
16870,The Last: Naruto the Movie,"Action, Martial Arts, Romance, Shounen, Super Power",Movie,1,7.88,85013
479,The Law of Ueki,"Adventure, Comedy, Drama, Shounen, Supernatural",TV,51,7.88,60027
15197,Code Geass: Boukoku no Akito 2 - Hikisakareshi Yokuryuu,"Action, Mecha, Military",Movie,1,7.87,61020
32189,Danganronpa 3: The End of Kibougamine Gakuen - Mirai-hen,"Action, Horror, Mystery, Psychological",TV,12,7.87,83343
31859,Hai to Gensou no Grimgar,"Action, Adventure, Drama, Fantasy",TV,12,7.87,213342
15451,High School DxD New,"Action, Comedy, Demons, Ecchi, Harem, Romance, School",TV,12,7.87,266657
33446,Huyao Xiao Hongniang: Yue Hong,"Comedy, Romance",ONA,13,7.87,1043
570,Jin-Rou,"Drama, Military, Police, Psychological, Romance",Movie,1,7.87,62464
5680,K-On!,"Comedy, Music, School, Slice of Life",TV,13,7.87,386048
2175,Kino no Tabi: The Beautiful World - Byouki no Kuni - For You,"Adventure, Drama, Fantasy",Movie,1,7.87,23453
1887,Lucky☆Star,"Comedy, Parody, School, Slice of Life",TV,24,7.87,305837
90,Mobile Suit Gundam Wing,"Action, Drama, Mecha, Military, Sci-Fi, Space",TV,49,7.87,86001
91,Mobile Suit Gundam Wing: Endless Waltz,"Action, Drama, Mecha, Military, Sci-Fi, Space",OVA,3,7.87,28485
2594,Piano no Mori,"Adventure, Comedy, Drama, Music, School, Seinen",Movie,1,7.87,24278
210,Ranma ½,"Comedy, Fantasy, Martial Arts, Slice of Life",TV,161,7.87,105212
1007,Ranma ½ OVA,"Comedy, Martial Arts, Romance, Shounen",OVA,6,7.87,16804
19775,Sidonia no Kishi,"Action, Mecha, Sci-Fi, Seinen, Space",TV,12,7.87,118341
534,Slayers,"Adventure, Comedy, Demons, Fantasy, Magic",TV,26,7.87,73476
9790,Sora no Otoshimono: Tokeijikake no Angeloid,"Comedy, Drama, Ecchi, Harem, Romance, Sci-Fi, Shounen, Supernatural",Movie,1,7.87,70391
2582,Soukou Kihei Votoms,"Action, Drama, Mecha, Military, Sci-Fi, Space",TV,52,7.87,9008
407,Tantei Gakuen Q,"Comedy, Drama, Mystery, Police, Shounen",TV,45,7.87,16591
6213,Toaru Kagaku no Railgun,"Action, Sci-Fi, Super Power",TV,24,7.87,231079
1000,Uchuu Kaizoku Captain Harlock,"Action, Adventure, Drama, Sci-Fi, Seinen, Space",TV,42,7.87,14869
1375,Watashi no Ashinaga Ojisan,"Comedy, Historical, Romance, School, Shoujo, Slice of Life",TV,40,7.87,5600
8514,Break Blade 2: Ketsubetsu no Michi,"Action, Fantasy, Mecha, Military, Shounen",Movie,1,7.86,44900
951,Chibi Maruko-chan,"Comedy, Shoujo, Slice of Life",TV,142,7.86,4739
12117,Detective Conan Movie 16: The Eleventh Striker,"Adventure, Comedy, Mystery, Police, Shounen, Sports",Movie,1,7.86,14938
2508,Genshiken 2,"Comedy, Parody, Slice of Life",TV,12,7.86,55825
19115,Giovanni no Shima,"Drama, Historical",Movie,1,7.86,10115
6904,Hellsing I: Digest for Freaks,"Action, Horror, Military, Seinen, Super Power, Supernatural, Vampire",OVA,1,7.86,20263
22125,Kuroko no Basket: Mou Ikkai Yarimasen ka,"Comedy, School, Shounen, Sports",Special,1,7.86,20397
4454,Macross F: Close Encounter - Deculture Edition,"Action, Mecha, Military, Music, Sci-Fi, Space",Special,1,7.86,8911
32547,Non Non Biyori Repeat OVA,"Comedy, School, Seinen, Slice of Life",OVA,1,7.86,9729
15959,Nurarihyon no Mago OVA,"Action, Demons, Shounen, Supernatural",OVA,2,7.86,11401
16239,One Piece: Episode of Luffy - Hand Island no Bouken,"Action, Adventure, Comedy, Fantasy, Shounen, Super Power",Special,1,7.86,21489
31772,One Punch Man Specials,"Action, Comedy, Parody, Sci-Fi, Seinen, Super Power, Supernatural",Special,6,7.86,75502
396,Seikai no Senki,"Action, Military, Romance, Sci-Fi, Space",TV,13,7.86,18580
8407,Sora no Otoshimono: Forte,"Comedy, Ecchi, Harem, Romance, Sci-Fi, Shounen, Supernatural",TV,12,7.86,146697
20057,Space☆Dandy,"Comedy, Sci-Fi, Space",TV,13,7.86,123529
9074,Arakawa Under the Bridge x Bridge,"Comedy, Romance, Seinen",TV,13,7.85,80394
7305,Detective Conan Movie 10: Promo Special,"Adventure, Comedy, Mystery, Police, Shounen",Special,1,7.85,4069
226,Elfen Lied,"Action, Drama, Horror, Psychological, Romance, Seinen, Supernatural",TV,13,7.85,623511
644,Hachimitsu to Clover Specials,"Comedy, Drama, Josei, Romance, Slice of Life",Special,2,7.85,21164
2405,Hello! Lady Lynn,Drama,TV,36,7.85,1757
15117,Kami nomi zo Shiru Sekai: Tenri-hen,"Comedy, Harem, Romance, Shounen, Supernatural",OVA,2,7.85,68623
10460,Kimi to Boku.,"Comedy, Drama, Romance, School, Shounen, Slice of Life",TV,13,7.85,86196
6050,Mahou Sensei Negima! Mou Hitotsu no Sekai,"Action, Adventure, Ecchi, Magic, Shounen, Supernatural",OVA,4,7.85,12413
444,Maria-sama ga Miteru: Haru,"Drama, Romance, School, Shoujo, Shoujo Ai",TV,13,7.85,14983
82,Mobile Suit Gundam 0080: War in the Pocket,"Adventure, Drama, Mecha, Military, Sci-Fi, Space",OVA,6,7.85,22609
15315,Mondaiji-tachi ga Isekai kara Kuru Sou Desu yo?,"Comedy, Fantasy, Supernatural",TV,10,7.85,218231
30347,Nanatsu no Taizai OVA,"Action, Adventure, Fantasy, Shounen, Supernatural",OVA,2,7.85,37540
31704,One Punch Man: Road to Hero,"Action, Comedy, Parody, Sci-Fi, Seinen, Super Power, Supernatural",OVA,1,7.85,94839
1699,Romeo x Juliet,"Drama, Fantasy, Historical, Romance",TV,24,7.85,91530
517,School Rumble Ichi Gakki Hoshuu,"Comedy, Romance, School, Shounen",OVA,2,7.85,40868
29829,Tamayura: Sotsugyou Shashin Part 2 - Hibiki,"Comedy, Drama, Slice of Life",Movie,1,7.85,3304
30868,Ajin Part 1: Shoudou,"Action, Horror, Mystery, Seinen, Supernatural",Movie,1,7.84,22279
22199,Akame ga Kill!,"Action, Adventure, Fantasy",TV,24,7.84,492133
14941,AKB0048: Next Stage,"Music, Sci-Fi",TV,13,7.84,22302
978,Change!! Getter Robo: Sekai Saigo no Hi,"Action, Adventure, Horror, Mecha, Psychological, Sci-Fi, Shounen",OVA,13,7.84,5606
2994,Death Note Rewrite,"Mystery, Police, Psychological, Supernatural, Thriller",Special,2,7.84,88699
14735,Detective Conan Movie 17: Private Eye in the Distant Sea,"Adventure, Comedy, Mystery, Police, Shounen",Movie,1,7.84,12963
10350,Hakuouki Sekkaroku,"Action, Demons, Drama, Fantasy, Historical, Josei",OVA,6,7.84,14725
20431,Hoozuki no Reitetsu,"Comedy, Fantasy, Supernatural",TV,13,7.84,47619
15487,Kuroko no Basket NG-shuu,"Comedy, School, Shounen, Sports",Special,9,7.84,32215
1462,Memories,"Drama, Horror, Psychological, Sci-Fi",Movie,3,7.84,38643
13667,Naruto: Shippuuden Movie 6 - Road to Ninja,"Action, Adventure, Martial Arts, Shounen, Super Power",Movie,1,7.84,87369
28927,Owari no Seraph: Nagoya Kessen-hen,"Action, Drama, Shounen, Supernatural, Vampire",TV,12,7.84,190058
398,Seikai no Senki III,"Action, Military, Romance, Sci-Fi, Space",OVA,2,7.84,11044
20847,Seitokai Yakuindomo*,"Comedy, School, Shounen, Slice of Life",TV,13,7.84,98544
2451,Space Cobra,"Action, Adventure, Sci-Fi, Space",TV,31,7.84,6919
8937,Toaru Majutsu no Index II,"Action, Magic, Sci-Fi, Super Power",TV,24,7.84,184520
12883,Tsuritama,"Comedy, Sci-Fi, Slice of Life, Sports",TV,12,7.84,90625
30413,Yowamushi Pedal Movie,"Comedy, Drama, Shounen, Sports",Movie,1,7.84,8838
30902,Yuru Yuri Nachuyachumi!+,"Comedy, Shoujo Ai, Slice of Life",Special,2,7.84,19586
6347,Baka to Test to Shoukanjuu,"Comedy, Romance, School, Super Power",TV,13,7.83,301282
3841,Chi&#039;s Sweet Home,"Comedy, Slice of Life",TV,104,7.83,36307
8086,Densetsu no Yuusha no Densetsu,"Action, Adventure, Fantasy, Magic, Shounen",TV,24,7.83,130689
9982,Fairy Tail OVA,"Comedy, Ecchi, Fantasy, Magic, Shounen",OVA,5,7.83,83421
1888,Ichigo Mashimaro OVA,"Comedy, School, Slice of Life",OVA,3,7.83,15085
33082,Kingsglaive: Final Fantasy XV,Action,Movie,1,7.83,15508
1096,Mobile Police Patlabor 2: The Movie,"Drama, Mecha, Mystery, Police, Sci-Fi",Movie,1,7.83,11957
14407,Persona 3 the Movie 1: Spring of Birth,"Action, Fantasy, Seinen, Supernatural",Movie,1,7.83,45568
1719,Rozen Maiden: Ouvertüre,"Action, Comedy, Drama, Magic, Seinen",Special,2,7.83,44388
290,Seikai no Monshou,"Action, Military, Romance, Sci-Fi, Space",TV,13,7.83,26379
154,Shaman King,"Action, Adventure, Comedy, Drama, Shounen, Supernatural",TV,64,7.83,169517
11757,Sword Art Online,"Action, Adventure, Fantasy, Game, Romance",TV,25,7.83,893100
5074,Tetsuwan Birdy Decode:02,"Action, Comedy, Sci-Fi",TV,12,7.83,29622
31733,Bishoujo Senshi Sailor Moon Crystal Season III,"Demons, Magic, Romance, Shoujo",TV,13,7.83,16530
1690,Bokurano,"Drama, Mecha, Psychological, Sci-Fi",TV,24,7.82,81408
4177,Bounen no Xamdou,"Action, Military, Sci-Fi",ONA,26,7.82,79026
10092,Break Blade 6: Doukoku no Toride,"Action, Mecha, Military, Shounen",Movie,1,7.82,39077
9785,Detective Conan: Conan vs. Kid - Shark &amp; Jewel,"Adventure, Comedy, Kids, Mystery, Police, Shounen",Movie,1,7.82,2688
985,Dragon Ball Z Special 2: Zetsubou e no Hankou!! Nokosareta Chousenshi - Gohan to Trunks,"Adventure, Drama, Fantasy, Shounen",Special,1,7.82,43673
18055,Hakkenden: Touhou Hakken Ibun 2nd Season,"Action, Fantasy, Shoujo, Supernatural",TV,13,7.82,33466
6984,Hidamari Sketch x 365 Specials,"Comedy, School, Slice of Life",Special,3,7.82,10720
27991,K: Return of Kings,"Action, Super Power, Supernatural",TV,13,7.82,114904
21659,Kill la Kill Special,"Action, Comedy, School, Super Power",Special,1,7.82,83795
3545,Kochira Katsushikaku Kameari Kouenmae Hashutsujo (TV),"Comedy, Police, Slice of Life",TV,373,7.82,4734
474,Macross Plus,"Drama, Mecha, Military, Romance, Sci-Fi, Space",OVA,4,7.82,23138
1211,Macross Plus Movie Edition,"Action, Adventure, Mecha, Military, Romance, Sci-Fi, Space",Movie,1,7.82,8405
9510,Mitsudomoe Zouryouchuu!,"Comedy, School, Slice of Life",TV,8,7.82,26468
5751,Prince of Tennis: Another Story - Messages From Past and Future,"Comedy, School, Shounen, Sports",OVA,4,7.82,9487
3515,Saint Seiya: Meiou Hades Elysion-hen,"Action, Fantasy, Shounen, Super Power",OVA,6,7.82,19044
13663,To LOVE-Ru Darkness,"Comedy, Ecchi, Harem, Romance, School, Sci-Fi, Shounen",TV,12,7.82,135929
13851,To LOVE-Ru Darkness OVA,"Comedy, Ecchi, Harem, Romance, School, Sci-Fi, Shounen",OVA,6,7.82,57166
6956,Working!!,"Comedy, Slice of Life",TV,13,7.82,189367
9441,Yume-iro Pâtissière SP Professional,"Shoujo, Slice of Life",TV,13,7.82,20397
233,Daa! Daa! Daa!,"Comedy, Sci-Fi, Shoujo",TV,78,7.81,12673
2397,Digimon Adventure: Bokura no War Game!,"Adventure, Comedy, Kids, Sci-Fi",Movie,1,7.81,37078
345,Eikoku Koi Monogatari Emma,"Drama, Historical, Romance, Seinen, Slice of Life",TV,12,7.81,23877
71,Full Metal Panic!,"Action, Comedy, Mecha, Military, Sci-Fi",TV,24,7.81,256325
10793,Guilty Crown,"Action, Drama, Sci-Fi, Super Power",TV,22,7.81,460959
9760,Hoshi wo Ou Kodomo,"Adventure, Fantasy, Romance",Movie,1,7.81,76286
160,"Ima, Soko ni Iru Boku","Adventure, Drama, Fantasy, Military, Sci-Fi",TV,13,7.81,56839
3713,Jigoku Shoujo Mitsuganae,"Mystery, Psychological, Supernatural",TV,26,7.81,58993
2593,Kara no Kyoukai 1: Fukan Fuukei,"Action, Mystery, Supernatural, Thriller",Movie,1,7.81,178880
2454,Kimagure Orange☆Road: Ano Hi ni Kaeritai,"Comedy, Drama, Romance, Shounen, Slice of Life",Movie,1,7.81,4368
32380,Kono Subarashii Sekai ni Shukufuku wo! OVA,"Comedy, Fantasy",OVA,1,7.81,46823
33263,Kubikiri Cycle: Aoiro Savant to Zaregototsukai,"Action, Drama, Mystery, Supernatural",OVA,8,7.82,19317
13203,Lupin the Third: Mine Fujiko to Iu Onna,"Action, Adventure, Comedy, Ecchi, Samurai, Seinen",TV,13,7.81,22796
2963,Minami-ke,"Comedy, School, Slice of Life",TV,13,7.81,105471
87,Mobile Suit Gundam: Char&#039;s Counterattack,"Drama, Mecha, Military, Sci-Fi, Space",Movie,1,7.81,19258
20,Naruto,"Action, Comedy, Martial Arts, Shounen, Super Power",TV,220,7.81,683297
31953,New Game!,"Comedy, Slice of Life",TV,12,7.81,91932
28069,Shigatsu wa Kimi no Uso: Moments,"Music, Shounen",OVA,1,7.81,41368
1002,Top wo Nerae 2! Diebuster,"Action, Comedy, Mecha, Sci-Fi, Space",OVA,6,7.81,38691
9471,Baka to Test to Shoukanjuu: Matsuri,"Comedy, School, Super Power",OVA,2,7.80,67684
150,Blood+,"Action, Drama, Horror, Military, Mystery, Supernatural, Vampire",TV,50,7.80,208321
60,Chrno Crusade,"Action, Demons, Historical, Romance, Supernatural",TV,24,7.80,140865
19671,Free!: FrFr - Short Movie,"Comedy, Sports",Special,7,7.80,35956
